item_group,item_category,item,item_group,item_category,item,item_code
BARANGAN BERBUNGKUS,BERAS,BERAS BASMATHI - FAIZA (KASHMIR),1,1,1,1
BARANGAN BERBUNGKUS,BERAS,BERAS CAP FAIZA EMAS (SST5%),1,1,1,1
BARANGAN BERBUNGKUS,BERAS,BERAS CAP GOLDEN SARAWAK (SST5%),1,1,1,1
BARANGAN BERBUNGKUS,BERAS,BERAS CAP JASMINE (SST5%),1,1,1,1
BARANGAN BERBUNGKUS,BERAS,BERAS CAP JATI (SST5%),1,1,1,1
BARANGAN BERBUNGKUS,BERAS,BERAS CAP RAMBUTAN (SST5%),1,1,1,1
BARANGAN BERBUNGKUS,BERAS,BERAS PREMIUM CAP UNCLE TAN,1,1,1,1
BARANGAN BERBUNGKUS,BERAS,BERAS PULUT THAILAND (BIASA) PELBAGAI JENAMA,1,1,1,1
BARANGAN BERBUNGKUS,BERAS,BERAS PULUT THAILAND (SUSU) PELBAGAI JENAMA,1,1,1,1
BARANGAN BERBUNGKUS,BERAS,BERAS SUPER CAP 3A BOY (IMPORT),1,1,1,1
BARANGAN BERBUNGKUS,BERAS,BERAS SUPER CAP ANGGUR SAZARICE 5% (IMPORT THAILAND),1,1,1,1
BARANGAN BERBUNGKUS,BERAS,BERAS SUPER CAP JATI TWR  5% (IMPORT),1,1,1,1
BARANGAN BERBUNGKUS,BERAS,BERAS SUPER CAP RAMBUTAN 5% (IMPORT),1,1,1,1
BARANGAN BERBUNGKUS,BERAS,BERAS SUPER CAP RODA SAZARICE 5% (IMPORT THAILAND),1,1,1,1
BARANGAN BERBUNGKUS,BERAS,BERAS SUPER HUMA CAP KELISA EMAS (SABAH),1,1,1,1
BARANGAN BERBUNGKUS,BERAS,BERAS SUPER SPECIAL CAP FAMILI 5%,1,1,1,1
BARANGAN BERBUNGKUS,BERAS,BERAS SUPER SPECIAL TEMPATAN SABAH RICE VAGAS TOKOU,1,1,1,1
BARANGAN BERBUNGKUS,BERAS,BERAS SUPER WR (5%),1,1,1,1
BARANGAN BERBUNGKUS,BERAS,BERAS TQR SABAH CAP TKC 5%,1,1,1,1
BARANGAN BERBUNGKUS,BIHUN,BIHUN KERING IMPORT (CAP BINTANG),1,1,1,1
BARANGAN BERBUNGKUS,BIHUN,BIHUN KERING IMPORT (PELBAGAI JENAMA),1,1,1,1
BARANGAN BERBUNGKUS,BIHUN,BIHUN KERING TEMPATAN (CAP JASMINE),1,1,1,1
BARANGAN BERBUNGKUS,ESEN DAN RAGI,BUNGA RAYA YIS SEGERA,1,1,1,1
BARANGAN BERBUNGKUS,ESEN DAN RAGI,ESEN STAR BRAND 'PELBAGAI PERISA',1,1,1,1
BARANGAN BERBUNGKUS,ESEN DAN RAGI,MAURIPAN YIS SEGERA,1,1,1,1
BARANGAN BERBUNGKUS,ESEN DAN RAGI,RAGI BULAT/RAGI TAPAI,1,1,1,1
BARANGAN BERBUNGKUS,ESEN DAN RAGI,SERBUK PENAIK ROYAL (TIN),1,1,1,2
BARANGAN BERBUNGKUS,GULA,GULA HALUS CASTOR (PELBAGAI JENAMA),1,1,1,1
BARANGAN BERBUNGKUS,GULA,GULA MERAH LEMBUT (PELBAGAI JENAMA),1,1,1,1
BARANGAN BERBUNGKUS,GULA,GULA PUTIH BERTAPIS HALUS (PELBAGAI JENAMA),1,1,1,1
BARANGAN BERBUNGKUS,GULA,GULA PUTIH BERTAPIS KASAR (PELBAGAI JENAMA),1,1,1,1
BARANGAN BERBUNGKUS,IKAN DALAM TIN,MACKAREL CAP AYAM (SOS TOMATO),1,1,1,2
BARANGAN BERBUNGKUS,IKAN DALAM TIN,MACKAREL CAP KING CUP (SOS TOMATO),1,1,1,2
BARANGAN BERBUNGKUS,IKAN DALAM TIN,SARDIN CAP ADABI (SOS TOMATO DENGAN CILI),1,1,1,1
BARANGAN BERBUNGKUS,IKAN DALAM TIN,SARDIN CAP AYAM (SOS TOMATO),1,1,1,2
BARANGAN BERBUNGKUS,IKAN DALAM TIN,SARDIN CAP KING CUP (SOS TOMATO),1,1,1,2
BARANGAN BERBUNGKUS,IKAN DALAM TIN,TUNA CAP AYAM (TUNA MAYONNAISE),1,1,1,1
BARANGAN BERBUNGKUS,IKAN DALAM TIN,TUNA CAP TC BOY (SANDWICH DELITE),1,1,1,1
BARANGAN BERBUNGKUS,KICAP DAN SOS,KICAP LEMAK MANIS CAP JALEN,1,1,1,1
BARANGAN BERBUNGKUS,KICAP DAN SOS,KICAP LEMAK MANIS CAP KIPAS UDANG,1,1,1,1
BARANGAN BERBUNGKUS,KICAP DAN SOS,KICAP LEMAK MASIN CAP KIPAS UDANG,1,1,1,1
BARANGAN BERBUNGKUS,KICAP DAN SOS,KICAP MANIS ADABI,1,1,1,1
BARANGAN BERBUNGKUS,KICAP DAN SOS,KICAP MASIN ADABI,1,1,1,1
BARANGAN BERBUNGKUS,KICAP DAN SOS,KICAP SOYA PEKAT MANIS CAP AYAM,1,1,1,1
BARANGAN BERBUNGKUS,KICAP DAN SOS,KICAP TAMIN (DARK SOY SAUCE),1,1,1,1
BARANGAN BERBUNGKUS,KICAP DAN SOS,KICAP TONG NAM (DARK SOY SAUCE),1,1,1,1
BARANGAN BERBUNGKUS,KICAP DAN SOS,SOS CILI KIMBALL,1,1,1,1
BARANGAN BERBUNGKUS,KICAP DAN SOS,SOS CILI LIFE,1,1,1,1
BARANGAN BERBUNGKUS,KICAP DAN SOS,SOS CILI MAGGI,1,1,1,2
BARANGAN BERBUNGKUS,KICAP DAN SOS,SOS CILI THAI LIFE,1,1,1,1
BARANGAN BERBUNGKUS,KICAP DAN SOS,SOS TIRAM ADABI,1,1,1,1
BARANGAN BERBUNGKUS,KICAP DAN SOS,SOS TIRAM KIMBALL,1,1,1,1
BARANGAN BERBUNGKUS,KICAP DAN SOS,SOS TIRAM MAGGI,1,1,1,1
BARANGAN BERBUNGKUS,KICAP DAN SOS,SOS TIRAM NONA,1,1,1,1
BARANGAN BERBUNGKUS,KICAP DAN SOS,SOS TOMATO LIFE,1,1,1,1
BARANGAN BERBUNGKUS,KICAP DAN SOS,SOS TOMATO MAGGI,1,1,1,1
BARANGAN BERBUNGKUS,KRIMER DAN SUSU TEPUNG,ANMUM LACTA (BIASA),1,1,1,1
BARANGAN BERBUNGKUS,KRIMER DAN SUSU TEPUNG,ANMUM MATERNA (BIASA/COKLAT),1,1,1,1
BARANGAN BERBUNGKUS,KRIMER DAN SUSU TEPUNG,KRIMER MANIS BERVITAMIN CAP F&N,1,1,1,1
BARANGAN BERBUNGKUS,KRIMER DAN SUSU TEPUNG,KRIMER MANIS CAP GOLD COIN,1,1,1,1
BARANGAN BERBUNGKUS,KRIMER DAN SUSU TEPUNG,KRIMER MANIS CAP JUNJUNG,1,1,1,1
BARANGAN BERBUNGKUS,KRIMER DAN SUSU TEPUNG,KRIMER MANIS CAP TEAPOT,1,1,1,1
BARANGAN BERBUNGKUS,KRIMER DAN SUSU TEPUNG,KRIMER MANIS PEKAT CAP SAJI,1,1,1,1
BARANGAN BERBUNGKUS,KRIMER DAN SUSU TEPUNG,KRIMER SEJAT CAIR SAJI,1,1,1,1
BARANGAN BERBUNGKUS,KRIMER DAN SUSU TEPUNG,KRIMER SEJAT CAP F&N,1,1,1,1
BARANGAN BERBUNGKUS,KRIMER DAN SUSU TEPUNG,KRIMER SEJAT CARNATION,1,1,1,1
BARANGAN BERBUNGKUS,KRIMER DAN SUSU TEPUNG,SUSU ANLENE ACTIFIT 3X COKLAT,1,1,1,1
BARANGAN BERBUNGKUS,KRIMER DAN SUSU TEPUNG,SUSU ANLENE ACTIFIT 3X PERISA ASLI,1,1,1,1
BARANGAN BERBUNGKUS,KRIMER DAN SUSU TEPUNG,SUSU ANLENE GOLD 5X,1,1,1,1
BARANGAN BERBUNGKUS,KRIMER DAN SUSU TEPUNG,SUSU ISIAN PEKAT MANIS CAP F & N,1,1,1,1
BARANGAN BERBUNGKUS,KRIMER DAN SUSU TEPUNG,SUSU SEJAT PENUH KRIM CAP IDEAL,1,1,1,1
BARANGAN BERBUNGKUS,KRIMER DAN SUSU TEPUNG,SUSU TEPUNG ISIAN KURANG LEMAK 'OMEGA PLUS',1,1,1,2
BARANGAN BERBUNGKUS,KRIMER DAN SUSU TEPUNG,SUSU TEPUNG PENUH KRIM DUTCHLADY,1,1,1,1
BARANGAN BERBUNGKUS,KRIMER DAN SUSU TEPUNG,SUSU TEPUNG PENUH KRIM SEGERA NESPRAY,1,1,1,1
BARANGAN BERBUNGKUS,KRIMER DAN SUSU TEPUNG,SUSU TEPUNG SEGERA DUTCHLADY (BIASA ),1,1,1,1
BARANGAN BERBUNGKUS,KRIMER DAN SUSU TEPUNG,SUSU TEPUNG SEGERA EVERYDAY,1,1,1,2
BARANGAN BERBUNGKUS,KRIMER DAN SUSU TEPUNG,SUSU TEPUNG SEGERA FERNLEAF (INSTANT),1,1,1,1
BARANGAN BERBUNGKUS,MENTEGA,MENTEGA ANCHOR (SALTED),1,1,1,1
BARANGAN BERBUNGKUS,MENTEGA,MENTEGA SCS (SALTED),1,1,1,1
BARANGAN BERBUNGKUS,MI SEGERA,CINTAN MI SEGERA PERISA AYAM,1,1,1,1
BARANGAN BERBUNGKUS,MI SEGERA,MAGGI MI SEGERA PERISA KARI,1,1,1,1
BARANGAN BERBUNGKUS,MI SEGERA,MI SEDAP MI GORENG PERISA ASLI,1,1,1,1
BARANGAN BERBUNGKUS,MINYAK DAN LEMAK,MINYAK JAGUNG CAP DAISY,1,1,1,3
BARANGAN BERBUNGKUS,MINYAK DAN LEMAK,MINYAK JAGUNG CAP MAZOLA,1,1,1,3
BARANGAN BERBUNGKUS,MINYAK DAN LEMAK,MINYAK JAGUNG CAP VECORN,1,1,1,3
BARANGAN BERBUNGKUS,MINYAK DAN LEMAK,MINYAK MASAK PAKET (PELBAGAI JENAMA),1,1,1,1
BARANGAN BERBUNGKUS,MINYAK DAN LEMAK,MINYAK MASAK SEBATIAN CAP ADELA GOLD,1,1,1,3
BARANGAN BERBUNGKUS,MINYAK DAN LEMAK,MINYAK MASAK SEBATIAN CAP HELANG,1,1,1,3
BARANGAN BERBUNGKUS,MINYAK DAN LEMAK,MINYAK MASAK SEBATIAN CAP NEPTUNE,1,1,1,3
BARANGAN BERBUNGKUS,MINYAK DAN LEMAK,MINYAK MASAK SEBATIAN CAP PISAU,1,1,1,3
BARANGAN BERBUNGKUS,MINYAK DAN LEMAK,MINYAK MASAK TULEN CAP ALIF,1,1,1,3
BARANGAN BERBUNGKUS,MINYAK DAN LEMAK,MINYAK MASAK TULEN CAP BURUH,1,1,1,3
BARANGAN BERBUNGKUS,MINYAK DAN LEMAK,MINYAK MASAK TULEN CAP SAJI,1,1,1,3
BARANGAN BERBUNGKUS,MINYAK DAN LEMAK,MINYAK MASAK TULEN CAP SERI MURNI,1,1,1,3
BARANGAN BERBUNGKUS,MINYAK DAN LEMAK,MINYAK MASAK TULEN CAP VESAWIT,1,1,1,3
BARANGAN BERBUNGKUS,MINYAK DAN LEMAK,MINYAK SAPI CAP QBB,1,1,1,1
BARANGAN BERBUNGKUS,MINYAK DAN LEMAK,MINYAK SAPI CAP WINDMILL GHEEBLEND,1,1,1,1
BARANGAN BERBUNGKUS,REMPAH RATUS (BERBUNGKUS),ASAM JAWA (BERBIJI) PELBAGAI JENAMA,1,1,1,1
BARANGAN BERBUNGKUS,REMPAH RATUS (BERBUNGKUS),ASAM JAWA (TIDAK BERBIJI) ADABI,1,1,1,1
BARANGAN BERBUNGKUS,REMPAH RATUS (BERBUNGKUS),GARAM HALUS BIASA (PELBAGAI JENAMA),1,1,1,1
BARANGAN BERBUNGKUS,REMPAH RATUS (BERBUNGKUS),KIUB SUP TOM YAM (MAGGI),1,1,1,1
BARANGAN BERBUNGKUS,REMPAH RATUS (BERBUNGKUS),PERENCAH NASI GORENG IKAN BILIS SERI AJI,1,1,1,1
BARANGAN BERBUNGKUS,REMPAH RATUS (BERBUNGKUS),PERENCAH TOM YAM ADABI,1,1,1,1
BARANGAN BERBUNGKUS,REMPAH RATUS (BERBUNGKUS),SERBUK CABAI ALAGAPPAS,1,1,1,1
BARANGAN BERBUNGKUS,REMPAH RATUS (BERBUNGKUS),SERBUK CILI BABAS,1,1,1,1
BARANGAN BERBUNGKUS,REMPAH RATUS (BERBUNGKUS),SERBUK CILI KIJANG,1,1,1,1
BARANGAN BERBUNGKUS,REMPAH RATUS (BERBUNGKUS),SERBUK KARI AYAM DAN DAGING ADABI,1,1,1,1
BARANGAN BERBUNGKUS,REMPAH RATUS (BERBUNGKUS),SERBUK KARI DAGING ALAGAPPAS,1,1,1,2
BARANGAN BERBUNGKUS,REMPAH RATUS (BERBUNGKUS),SERBUK KARI DAGING BABAS,1,1,1,1
BARANGAN BERBUNGKUS,REMPAH RATUS (BERBUNGKUS),SERBUK KARI IKAN ADABI,1,1,1,1
BARANGAN BERBUNGKUS,REMPAH RATUS (BERBUNGKUS),SERBUK KARI IKAN ALAGAPPAS,1,1,1,2
BARANGAN BERBUNGKUS,REMPAH RATUS (BERBUNGKUS),SERBUK KARI IKAN BABAS,1,1,1,1
BARANGAN BERBUNGKUS,REMPAH RATUS (BERBUNGKUS),SERBUK KARI KURMA ALAGAPPAS,1,1,1,1
BARANGAN BERBUNGKUS,REMPAH RATUS (BERBUNGKUS),SERBUK KUNYIT ALAGAPPAS,1,1,1,1
BARANGAN BERBUNGKUS,REMPAH RATUS (BERBUNGKUS),SERBUK KUNYIT BABAS,1,1,1,1
BARANGAN BERBUNGKUS,REMPAH RATUS (BERBUNGKUS),SERBUK KUNYIT CAMPURAN (SEBATIAN) ADABI,1,1,1,1
BARANGAN BERBUNGKUS,REMPAH RATUS (BERBUNGKUS),SERBUK KURMA AYAM & DAGING ADABI,1,1,1,1
BARANGAN BERBUNGKUS,REMPAH RATUS (BERBUNGKUS),SERBUK KURMA BABAS,1,1,1,1
BARANGAN BERBUNGKUS,REMPAH RATUS (BERBUNGKUS),SERBUK NASI GORENG CINA ADABI,1,1,1,1
BARANGAN BERBUNGKUS,REMPAH RATUS (BERBUNGKUS),SERBUK PERENCAH SUP ADABI,1,1,1,1
BARANGAN BERBUNGKUS,REMPAH RATUS (BERBUNGKUS),SERBUK REMPAH SUP MAK SITI,1,1,1,1
BARANGAN BERBUNGKUS,REMPAH RATUS (BERBUNGKUS),SERBUK SUP FAIZA,1,1,1,1
BARANGAN BERBUNGKUS,REMPAH RATUS (BERBUNGKUS),SUP BUNJUT ADABI,1,1,1,1
BARANGAN BERBUNGKUS,REMPAH RATUS (BERBUNGKUS),SUP PUNJUT MAK SITI,1,1,1,1
BARANGAN BERBUNGKUS,REMPAH RATUS (TIDAK BERBUNGKUS),BIJI KETUMBAR,1,1,1,1
BARANGAN BERBUNGKUS,REMPAH RATUS (TIDAK BERBUNGKUS),BIJI SAWI,1,1,1,1
BARANGAN BERBUNGKUS,REMPAH RATUS (TIDAK BERBUNGKUS),BUAH KERAS,1,1,1,1
BARANGAN BERBUNGKUS,REMPAH RATUS (TIDAK BERBUNGKUS),BUAH PALA,1,1,1,1
BARANGAN BERBUNGKUS,REMPAH RATUS (TIDAK BERBUNGKUS),BUAH PELAGA,1,1,1,1
BARANGAN BERBUNGKUS,REMPAH RATUS (TIDAK BERBUNGKUS),BUNGA CENGKIH,1,1,1,1
BARANGAN BERBUNGKUS,REMPAH RATUS (TIDAK BERBUNGKUS),BUNGA LAWANG,1,1,1,1
BARANGAN BERBUNGKUS,REMPAH RATUS (TIDAK BERBUNGKUS),HALBA,1,1,1,1
BARANGAN BERBUNGKUS,REMPAH RATUS (TIDAK BERBUNGKUS),JINTAN MANIS (KASAR),1,1,1,1
BARANGAN BERBUNGKUS,REMPAH RATUS (TIDAK BERBUNGKUS),KULIT KAYU MANIS,1,1,1,1
BARANGAN BERBUNGKUS,REMPAH RATUS (TIDAK BERBUNGKUS),LADA HITAM,1,1,1,1
BARANGAN BERBUNGKUS,REMPAH RATUS (TIDAK BERBUNGKUS),LADA PUTIH,1,1,1,1
BARANGAN BERBUNGKUS,REMPAH RATUS (TIDAK BERBUNGKUS),REMPAH KURMA (TIDAK BERBUNGKUS),1,1,1,1
BARANGAN BERBUNGKUS,REMPAH RATUS (TIDAK BERBUNGKUS),REMPAH SUP (TIDAK BERBUNGKUS),1,1,1,1
BARANGAN BERBUNGKUS,REMPAH RATUS (TIDAK BERBUNGKUS),SERBUK CILI  (TIDAK BERBUNGKUS),1,1,1,1
BARANGAN BERBUNGKUS,REMPAH RATUS (TIDAK BERBUNGKUS),SERBUK KARI DAGING (TIDAK BERBUNGKUS),1,1,1,1
BARANGAN BERBUNGKUS,REMPAH RATUS (TIDAK BERBUNGKUS),SERBUK KARI IKAN (TIDAK BERBUNGKUS),1,1,1,1
BARANGAN BERBUNGKUS,REMPAH RATUS (TIDAK BERBUNGKUS),SERBUK KUNYIT (TIDAK BERBUNGKUS),1,1,1,1
BARANGAN BERBUNGKUS,ROTI,ROTI GARDENIA BREAKTHRU - ROTI GANDUM PENUH,1,1,1,1
BARANGAN BERBUNGKUS,ROTI,ROTI SANDWICH GARDENIA ORIGINAL CLASSIC,1,1,1,1
BARANGAN BERBUNGKUS,ROTI,ROTI SANDWICH MASSIMO DENGAN GERMA GANDUM,1,1,1,1
BARANGAN BERBUNGKUS,ROTI,ROTI WHOLEMEAL (PELBAGAI JENAMA),1,1,1,1
BARANGAN BERBUNGKUS,SANTAN (KOTAK),SANTAN KELAPA JENAMA AYAM BRAND,1,1,1,1
BARANGAN BERBUNGKUS,SANTAN (KOTAK),SANTAN KELAPA JENAMA HARMUNI,1,1,1,1
BARANGAN BERBUNGKUS,SANTAN (KOTAK),SANTAN KELAPA JENAMA KARA,1,1,1,1
BARANGAN BERBUNGKUS,SANTAN (KOTAK),SANTAN KELAPA JENAMA M&S,1,1,1,1
BARANGAN BERBUNGKUS,SAPUAN (SPREADS),BUTTERLITE (LEPA SUSU ISTIMEWA),1,1,1,1
BARANGAN BERBUNGKUS,SAPUAN (SPREADS),JEM STRAWBERI LADY'S CHOICE,1,1,1,1
BARANGAN BERBUNGKUS,SAPUAN (SPREADS),KRAFT DAIRYLEA SINGLES CHEESE 12 SLICES,1,1,1,1
BARANGAN BERBUNGKUS,SAPUAN (SPREADS),LEPAAN BUTTERCUP,1,1,1,1
BARANGAN BERBUNGKUS,SAPUAN (SPREADS),LEPAAN FARMCOWS,1,1,1,1
BARANGAN BERBUNGKUS,SAPUAN (SPREADS),MAINLAND CHESDALE CHEDDAR CHEESE SPREAD 12 CHEDDAR,1,1,1,1
BARANGAN BERBUNGKUS,SAPUAN (SPREADS),MARJERIN DAISY,1,1,1,2
BARANGAN BERBUNGKUS,SAPUAN (SPREADS),MARJERIN PLANTA,1,1,1,2
BARANGAN BERBUNGKUS,SAPUAN (SPREADS),MAYONIS SEBENAR LADY'S CHOICE,1,1,1,1
BARANGAN BERBUNGKUS,SAPUAN (SPREADS),MENTEGA KACANG HALUS LADY'S CHOICE,1,1,1,2
BARANGAN BERBUNGKUS,SAPUAN (SPREADS),SERI KAYA YEO'S,1,1,1,1
BARANGAN BERBUNGKUS,TEPUNG,TEPUNG BERAS (PELBAGAI JENAMA),1,1,1,1
BARANGAN BERBUNGKUS,TEPUNG,TEPUNG GANDUM GP (BERBUNGKUS) PELBAGAI JENAMA,1,1,1,1
BARANGAN BERBUNGKUS,TEPUNG,"TEPUNG GANDUM NGP (BERBUNGKUS, CAP  FAIZA)",1,1,1,1
BARANGAN BERBUNGKUS,TEPUNG,"TEPUNG GANDUM NGP (BERBUNGKUS, CAP MUHIBAH)",1,1,1,1
BARANGAN BERBUNGKUS,TEPUNG,"TEPUNG GANDUM NGP (BERBUNGKUS, CAP SAUH)",1,1,1,1
BARANGAN BERBUNGKUS,TEPUNG,TEPUNG JAGUNG (PELBAGAI JENAMA),1,1,1,1
BARANGAN BERBUNGKUS,TEPUNG,TEPUNG NAIK SENDIRI CAP 'BLUE KEY',1,1,1,1
BARANGAN BERBUNGKUS,TEPUNG,TEPUNG PULUT (PELBAGAI JENAMA),1,1,1,1
BARANGAN KERING,BAWANG,BAWANG BESAR IMPORT (CHINA),1,1,1,1
BARANGAN KERING,BAWANG,BAWANG BESAR IMPORT (INDIA),1,1,1,1
BARANGAN KERING,BAWANG,BAWANG BESAR IMPORT (PAKISTAN),1,1,1,1
BARANGAN KERING,BAWANG,BAWANG BESAR KUNING/HOLLAND,1,1,1,1
BARANGAN KERING,BAWANG,BAWANG KECIL MERAH BIASA IMPORT (INDIA),1,1,1,1
BARANGAN KERING,BAWANG,BAWANG KECIL MERAH IMPORT (CHINA),1,1,1,1
BARANGAN KERING,BAWANG,BAWANG KECIL MERAH IMPORT (HOLLAND),1,1,1,1
BARANGAN KERING,BAWANG,BAWANG KECIL MERAH IMPORT (MYANMAR),1,1,1,1
BARANGAN KERING,BAWANG,BAWANG KECIL MERAH IMPORT (THAILAND),1,1,1,1
BARANGAN KERING,BAWANG,BAWANG KECIL MERAH ROSE IMPORT (INDIA),1,1,1,1
BARANGAN KERING,BAWANG,BAWANG PUTIH IMPORT (CHINA),1,1,1,1
BARANGAN KERING,CILI KERING,CILI KERING KERINTING (BERTANGKAI/TIDAK BERTANGKAI),1,1,1,1
BARANGAN KERING,CILI KERING,CILI KERING LEPER (BERTANGKAI/TIDAK BERTANGKAI),1,1,1,1
BARANGAN KERING,HASIL LAUT KERING,IKAN BILIS GRED B (KOPEK),1,1,1,1
BARANGAN KERING,HASIL LAUT KERING,SOTONG KERING (SAIZ SERDAHANA),1,1,1,1
BARANGAN KERING,HASIL LAUT KERING,UDANG KERING,1,1,1,1
BARANGAN KERING,KACANG,KACANG DAL (AUSTRALIA),1,1,1,1
BARANGAN KERING,KACANG,KACANG DAL BIASA (INDIA),1,1,1,1
BARANGAN KERING,KACANG,KACANG DAL MALAVI (INDIA),1,1,1,1
BARANGAN KERING,KACANG,KACANG HIJAU (IMPORT),1,1,1,1
BARANGAN KERING,KACANG,KACANG MERAH (IMPORT),1,1,1,1
BARANGAN KERING,KACANG,KACANG SOYA (IMPORT),1,1,1,1
BARANGAN KERING,KACANG,KACANG TANAH (IMPORT),1,1,1,1
BARANGAN KERING,UBI KENTANG,UBI KENTANG HOLLAND,1,1,1,1
BARANGAN KERING,UBI KENTANG,UBI KENTANG IMPORT (CHINA),1,1,1,1
BARANGAN KERING,UBI KENTANG,UBI KENTANG RUSSET,1,1,1,1
BARANGAN SEGAR,AYAM,AYAM BELANDA IMPORT,1,1,1,1
BARANGAN SEGAR,AYAM,AYAM BERSIH - STANDARD,1,1,1,1
BARANGAN SEGAR,AYAM,AYAM BERSIH - SUPER,1,1,1,1
BARANGAN SEGAR,AYAM,AYAM HIDUP,1,1,1,1
BARANGAN SEGAR,AYAM,DADA AYAM (CHICKEN KEEL) (1KG),1,1,1,1
BARANGAN SEGAR,AYAM,KEPAK AYAM (CHICKEN WING) (1KG),1,1,1,1
BARANGAN SEGAR,AYAM,PAHA AYAM (CHICKEN DRUMSTICK),1,1,1,1
BARANGAN SEGAR,AYAM,THIGH AYAM,1,1,1,1
BARANGAN SEGAR,AYAM,WHOLE LEG AYAM,1,1,1,1
BARANGAN SEGAR,BAHAN LAUT,IKAN BAWAL HITAM (ANTARA 2 HINGGA 5 EKOR SEKILOGRAM),1,1,1,1
BARANGAN SEGAR,BAHAN LAUT,IKAN BAWAL PUTIH (ANTARA 2 HINGGA 5 EKOR SEKILOGRAM),1,1,1,1
BARANGAN SEGAR,BAHAN LAUT,IKAN CENCARU (ANTARA 4 HINGGA 6 EKOR SEKILOGRAM),1,1,1,1
BARANGAN SEGAR,BAHAN LAUT,IKAN DEMUDUK/CUPAK/CERMIN (b	$ 3 EKOR SEKILOGRAM),1,1,1,1
BARANGAN SEGAR,BAHAN LAUT,IKAN GELAMA (ANTARA 5 HINGGA 10 EKOR SEKILOGRAM),1,1,1,1
BARANGAN SEGAR,BAHAN LAUT,IKAN JENAHAK (KEPINGAN),1,1,1,1
BARANGAN SEGAR,BAHAN LAUT,IKAN JENAHAK (b	% 1 KILOGRAM SEEKOR),1,1,1,1
BARANGAN SEGAR,BAHAN LAUT,IKAN KEMBUNG (ANTARA 8 HINGGA 12 EKOR SEKILOGRAM),1,1,1,1
BARANGAN SEGAR,BAHAN LAUT,IKAN KEMBUNG KECIL/PELALING (ANTARA 10 HINGGA 18 EKOR SEKILOGRAM),1,1,1,1
BARANGAN SEGAR,BAHAN LAUT,IKAN KERAPU (ANTARA 2 HINGGA 5 EKOR SEKILOGRAM),1,1,1,1
BARANGAN SEGAR,BAHAN LAUT,IKAN KERISI (ANTARA 5 HINGGA 10 EKOR SEKILOGRAM),1,1,1,1
BARANGAN SEGAR,BAHAN LAUT,IKAN MABUNG (ANTARA 6 HINGGA 10 EKOR SEKILOGRAM),1,1,1,1
BARANGAN SEGAR,BAHAN LAUT,IKAN MERAH (KEPINGAN),1,1,1,1
BARANGAN SEGAR,BAHAN LAUT,IKAN MERAH (b	% 1 KILOGRAM SEEKOR),1,1,1,1
BARANGAN SEGAR,BAHAN LAUT,IKAN PARANG (ANTARA 1 HINGGA 3 EKOR SEKILOGRAM),1,1,1,1
BARANGAN SEGAR,BAHAN LAUT,IKAN PARANG (KEPINGAN),1,1,1,1
BARANGAN SEGAR,BAHAN LAUT,IKAN PARI (KEPINGAN),1,1,1,1
BARANGAN SEGAR,BAHAN LAUT,IKAN SELAR KUNING (b	% 11 EKOR SEKILOGRAM),1,1,1,1
BARANGAN SEGAR,BAHAN LAUT,IKAN SELAR PELATA (≤ 7 EKOR SEKILOGRAM),1,1,1,1
BARANGAN SEGAR,BAHAN LAUT,IKAN SELAYANG/SARDIN  (≥ 13 EKOR SEKILOGRAM),1,1,1,1
BARANGAN SEGAR,BAHAN LAUT,IKAN SENANGIN (ANTARA 2 HINGGA 8 EKOR SEKILOGRAM),1,1,1,1
BARANGAN SEGAR,BAHAN LAUT,IKAN SIAKAP (ANTARA 2 HINGGA 4 EKOR SEKILOGRAM),1,1,1,1
BARANGAN SEGAR,BAHAN LAUT,IKAN TAMBAN BELURU (ANTARA 10 HINGGA 19 EKOR SEKILOGRAM),1,1,1,1
BARANGAN SEGAR,BAHAN LAUT,IKAN TENGGIRI BATANG (ANTARA 1 HINGGA 2 EKOR SEKILOGRAM),1,1,1,1
BARANGAN SEGAR,BAHAN LAUT,IKAN TENGGIRI BATANG (KEPINGAN),1,1,1,1
BARANGAN SEGAR,BAHAN LAUT,IKAN TENGGIRI PAPAN (ANTARA 1 HINGGA 2 EKOR SEKILOGRAM),1,1,1,1
BARANGAN SEGAR,BAHAN LAUT,IKAN TERUBOK (b	$ 4 EKOR SEKILOGRAM),1,1,1,1
BARANGAN SEGAR,BAHAN LAUT,IKAN TONGKOL/AYA/KAYU HITAM (ANTARA 1 HINGGA 2 EKOR SEKILOGRAM),1,1,1,1
BARANGAN SEGAR,BAHAN LAUT,KEPALA IKAN JENAHAK,1,1,1,1
BARANGAN SEGAR,BAHAN LAUT,KEPALA IKAN MERAH,1,1,1,1
BARANGAN SEGAR,BAHAN LAUT,KERANG (SAIZ SEDERHANA),1,1,1,1
BARANGAN SEGAR,BAHAN LAUT,KETAM RENJONG/BUNGA (ANTARA 5 HINGGA 8 EKOR SEKILOGRAM),1,1,1,1
BARANGAN SEGAR,BAHAN LAUT,SOTONG (≥ 6 EKOR SEKILOGRAM),1,1,1,1
BARANGAN SEGAR,BAHAN LAUT,UDANG HARIMAU (ANTARA 20 HINGGA 30 EKOR SEKILOGRAM),1,1,1,1
BARANGAN SEGAR,BAHAN LAUT,UDANG PUTIH BESAR (ANTARA 20 HINGGA 30 EKOR SEKILOGRAM),1,1,1,1
BARANGAN SEGAR,BAHAN LAUT,UDANG PUTIH BESAR/BANANA PRAWN (BERAT ANTARA 41 EKOR HINGGA 60 EKOR SEKILOGRAM),1,1,1,1
BARANGAN SEGAR,BAHAN LAUT,UDANG PUTIH KECIL (b	% 61 EKOR SEKILOGRAM),1,1,1,1
BARANGAN SEGAR,BAHAN LAUT,UDANG PUTIH/VANNAMEI (TERNAK) (ANTARA 41 HINGGA 60 EKOR SEKILOGRAM),1,1,1,1
BARANGAN SEGAR,BUAH-BUAHAN,ANGGUR HIJAU BERBIJI,1,1,1,1
BARANGAN SEGAR,BUAH-BUAHAN,ANGGUR MERAH BERBIJI,1,1,1,1
BARANGAN SEGAR,BUAH-BUAHAN,BETIK BIASA,1,1,1,1
BARANGAN SEGAR,BUAH-BUAHAN,DRAGON FRUIT MERAH,1,1,1,1
BARANGAN SEGAR,BUAH-BUAHAN,EPAL HIJAU GRANNY SMITH (SAIZ M),1,1,1,1
BARANGAN SEGAR,BUAH-BUAHAN,EPAL MERAH RED DELICIOUS (SAIZ M),1,1,1,1
BARANGAN SEGAR,BUAH-BUAHAN,JAMBU BATU BERBIJI,1,1,1,1
BARANGAN SEGAR,BUAH-BUAHAN,JAMBU BATU TANPA BIJI,1,1,1,1
BARANGAN SEGAR,BUAH-BUAHAN,LAI KUNING (SAIZ M),1,1,1,1
BARANGAN SEGAR,BUAH-BUAHAN,LIMAU NIPIS,1,1,1,1
BARANGAN SEGAR,BUAH-BUAHAN,NENAS BIASA (JOSAPINE/MORRIS/SARAWAK),1,1,1,1
BARANGAN SEGAR,BUAH-BUAHAN,OREN VALENCIA (SAIZ M),1,1,1,1
BARANGAN SEGAR,BUAH-BUAHAN,PISANG BERANGAN,1,1,1,1
BARANGAN SEGAR,BUAH-BUAHAN,PISANG EMAS,1,1,1,1
BARANGAN SEGAR,BUAH-BUAHAN,TEMBIKAI MERAH BERBIJI,1,1,1,1
BARANGAN SEGAR,BUAH-BUAHAN,TEMBIKAI MERAH TANPA BIJI,1,1,1,1
BARANGAN SEGAR,BUAH-BUAHAN,TEMBIKAI SUSU,1,1,1,1
BARANGAN SEGAR,DAGING,DAGING BABI (DAGING & LEMAK / LEAN & FAT),1,1,1,1
BARANGAN SEGAR,DAGING,DAGING BABI (ISI DAGING / PURE LEAN),1,1,1,1
BARANGAN SEGAR,DAGING,DAGING BABI (PERUT / BELLY),1,1,1,1
BARANGAN SEGAR,DAGING,DAGING BABI (RUSUK DENGAN DAGING/ RIBS WITH MEAT),1,1,1,1
BARANGAN SEGAR,DAGING,DAGING KAMBING BEBIRI IMPORT BERTULANG (LAMB) (AUSTRALIA - KOTAK) (1KG),1,1,1,1
BARANGAN SEGAR,DAGING,DAGING KAMBING BEBIRI IMPORT BERTULANG (LAMB) (NEW ZEALAND - KOTAK),1,1,1,1
BARANGAN SEGAR,DAGING,DAGING KAMBING BEBIRI IMPORT BERTULANG (MUTTON) (AUSTRALIA - KOTAK),1,1,1,1
BARANGAN SEGAR,DAGING,DAGING KAMBING BEBIRI IMPORT BERTULANG (MUTTON) (NEW ZEALAND - KOTAK),1,1,1,1
BARANGAN SEGAR,DAGING,DAGING KAMBING BEBIRI IMPORT TANPA TULANG (LAMB) (TIDAK TERMASUK PAHA - AUSTRALIA),1,1,1,1
BARANGAN SEGAR,DAGING,DAGING KAMBING BEBIRI IMPORT TANPA TULANG (LAMB) (TIDAK TERMASUK PAHA - NEW ZEALAND),1,1,1,1
BARANGAN SEGAR,DAGING,DAGING KAMBING BEBIRI IMPORT TANPA TULANG (MUTTON) (TIDAK TERMASUK PAHA - AUSTRALIA),1,1,1,1
BARANGAN SEGAR,DAGING,DAGING KAMBING BEBIRI IMPORT TANPA TULANG (MUTTON) (TIDAK TERMASUK PAHA - NEW ZEALAND),1,1,1,1
BARANGAN SEGAR,DAGING,DAGING KAMBING TEMPATAN BERTULANG,1,1,1,1
BARANGAN SEGAR,DAGING,DAGING KERBAU IMPORT (INDIA) (BLOCK),1,1,1,1
BARANGAN SEGAR,DAGING,DAGING KERBAU IMPORT (INDIA) * (BLADE),1,1,1,1
BARANGAN SEGAR,DAGING,DAGING KERBAU IMPORT (INDIA) * (CHUCK),1,1,1,1
BARANGAN SEGAR,DAGING,DAGING KERBAU IMPORT (INDIA) * (RUMP),1,1,1,1
BARANGAN SEGAR,DAGING,DAGING KERBAU IMPORT (INDIA) * (SILVERSIDE),1,1,1,1
BARANGAN SEGAR,DAGING,DAGING KERBAU IMPORT (INDIA) * (TOP SIDE),1,1,1,1
BARANGAN SEGAR,DAGING,DAGING KERBAU TEMPATAN,1,1,1,1
BARANGAN SEGAR,DAGING,DAGING LEMBU IMPORT (BLADE),1,1,1,1
BARANGAN SEGAR,DAGING,DAGING LEMBU IMPORT (BLOCK),1,1,1,1
BARANGAN SEGAR,DAGING,DAGING LEMBU IMPORT (CHUCKTENDER),1,1,1,1
BARANGAN SEGAR,DAGING,DAGING LEMBU IMPORT (KNUCKLE),1,1,1,1
BARANGAN SEGAR,DAGING,DAGING LEMBU IMPORT (TOPSIDE),1,1,1,1
BARANGAN SEGAR,DAGING,DAGING LEMBU TEMPATAN (BAHAGIAN 1 DAGING PAHA (KECUALI BATANG PINANG - TENDERLOIN),1,1,1,1
BARANGAN SEGAR,DAGING,DAGING LEMBU TEMPATAN (BAHAGIAN 2 DAGING PEJAL (KECUALI BATANG PINANG - TENDERLOIN),1,1,1,1
BARANGAN SEGAR,DAGING,DAGING PAHA KAMBING BEBIRI IMPORT BERTULANG  (MUTTON) (AUSTRALIA),1,1,1,1
BARANGAN SEGAR,DAGING,DAGING PAHA KAMBING BEBIRI IMPORT BERTULANG (LAMB) (AUSTRALIA),1,1,1,1
BARANGAN SEGAR,DAGING,DAGING PAHA KAMBING BEBIRI IMPORT BERTULANG (LAMB) (NEW ZEALAND),1,1,1,1
BARANGAN SEGAR,DAGING,DAGING PAHA KAMBING BEBIRI IMPORT BERTULANG (MUTTON) (NEW ZEALAND),1,1,1,1
BARANGAN SEGAR,IKAN DARAT,IKAN HARUAN (ANTARA 2 HINGGA 5 EKOR SEKILOGRAM),1,1,1,1
BARANGAN SEGAR,IKAN DARAT,IKAN KELI (ANTARA 2 HINGGA 5 EKOR SEKILOGRAM),1,1,1,1
BARANGAN SEGAR,IKAN DARAT,IKAN TILAPIA HITAM (ANTARA 2 HINGGA 5 EKOR SEKILOGRAM),1,1,1,1
BARANGAN SEGAR,IKAN DARAT,IKAN TILAPIA MERAH (ANTARA 2 HINGGA 5 EKOR SEKILOGRAM),1,1,1,1
BARANGAN SEGAR,KELAPA,KELAPA BIJI,1,1,1,1
BARANGAN SEGAR,KELAPA,KELAPA PARUT,1,1,1,1
BARANGAN SEGAR,KELAPA,SANTAN KELAPA SEGAR (BIASA),1,1,1,1
BARANGAN SEGAR,KELAPA,SANTAN KELAPA SEGAR (PEKAT),1,1,1,1
BARANGAN SEGAR,MEE/KUETIAU,KUETIAU BASAH (PELBAGAI JENAMA),1,1,1,1
BARANGAN SEGAR,MEE/KUETIAU,MEE KUNING BASAH (PELBAGAI JENAMA),1,1,1,1
BARANGAN SEGAR,SAYUR-SAYURAN,BAWANG PERAI (LEEK) IMPORT,1,1,1,1
BARANGAN SEGAR,SAYUR-SAYURAN,BAWANG PERAI (LEEK) TEMPATAN,1,1,1,1
BARANGAN SEGAR,SAYUR-SAYURAN,BAYAM HIJAU,1,1,1,1
BARANGAN SEGAR,SAYUR-SAYURAN,BAYAM MERAH,1,1,1,1
BARANGAN SEGAR,SAYUR-SAYURAN,BROKOLI,1,1,1,1
BARANGAN SEGAR,SAYUR-SAYURAN,CILI AKAR HIJAU,1,1,1,1
BARANGAN SEGAR,SAYUR-SAYURAN,CILI AKAR MERAH,1,1,1,1
BARANGAN SEGAR,SAYUR-SAYURAN,CILI API/PADI HIJAU,1,1,1,1
BARANGAN SEGAR,SAYUR-SAYURAN,CILI API/PADI MERAH,1,1,1,1
BARANGAN SEGAR,SAYUR-SAYURAN,CILI HIJAU,1,1,1,1
BARANGAN SEGAR,SAYUR-SAYURAN,CILI MERAH - KULAI,1,1,1,1
BARANGAN SEGAR,SAYUR-SAYURAN,CILI MERAH - MINYAK,1,1,1,1
BARANGAN SEGAR,SAYUR-SAYURAN,HALIA BASAH (TUA),1,1,1,1
BARANGAN SEGAR,SAYUR-SAYURAN,KACANG BENDI,1,1,1,1
BARANGAN SEGAR,SAYUR-SAYURAN,KACANG BOTOL,1,1,1,1
BARANGAN SEGAR,SAYUR-SAYURAN,KACANG BUNCIS,1,1,1,1
BARANGAN SEGAR,SAYUR-SAYURAN,KACANG PANJANG,1,1,1,1
BARANGAN SEGAR,SAYUR-SAYURAN,KAILAN,1,1,1,1
BARANGAN SEGAR,SAYUR-SAYURAN,KANGKUNG,1,1,1,1
BARANGAN SEGAR,SAYUR-SAYURAN,KUBIS BULAT (TEMPATAN),1,1,1,1
BARANGAN SEGAR,SAYUR-SAYURAN,KUBIS BULAT IMPORT (BEIJING),1,1,1,1
BARANGAN SEGAR,SAYUR-SAYURAN,KUBIS BULAT IMPORT (CHINA),1,1,1,1
BARANGAN SEGAR,SAYUR-SAYURAN,KUBIS BULAT IMPORT (INDONESIA),1,1,1,1
BARANGAN SEGAR,SAYUR-SAYURAN,KUBIS BUNGA (CAULIFLOWER),1,1,1,1
BARANGAN SEGAR,SAYUR-SAYURAN,KUBIS PANJANG (TEMPATAN),1,1,1,1
BARANGAN SEGAR,SAYUR-SAYURAN,KUBIS PANJANG CHINA - BESAR,1,1,1,1
BARANGAN SEGAR,SAYUR-SAYURAN,KUNYIT HIDUP,1,1,1,1
BARANGAN SEGAR,SAYUR-SAYURAN,LADA BENGGALA HIJAU (CAPSICUM),1,1,1,1
BARANGAN SEGAR,SAYUR-SAYURAN,LADA BENGGALA KUNING (CAPSICUM),1,1,1,1
BARANGAN SEGAR,SAYUR-SAYURAN,LADA BENGGALA MERAH (CAPSICUM),1,1,1,1
BARANGAN SEGAR,SAYUR-SAYURAN,LENGKUAS,1,1,1,1
BARANGAN SEGAR,SAYUR-SAYURAN,LIMAU KASTURI,1,1,1,1
BARANGAN SEGAR,SAYUR-SAYURAN,LOBAK MERAH,1,1,1,1
BARANGAN SEGAR,SAYUR-SAYURAN,SADERI,1,1,1,1
BARANGAN SEGAR,SAYUR-SAYURAN,SAWI HIJAU,1,1,1,1
BARANGAN SEGAR,SAYUR-SAYURAN,TAUGE KACANG HIJAU,1,1,1,1
BARANGAN SEGAR,SAYUR-SAYURAN,TERUNG BULAT,1,1,1,1
BARANGAN SEGAR,SAYUR-SAYURAN,TERUNG PANJANG,1,1,1,1
BARANGAN SEGAR,SAYUR-SAYURAN,TIMUN,1,1,1,1
BARANGAN SEGAR,SAYUR-SAYURAN,TOMATO,1,1,1,1
BARANGAN SEGAR,TAUHU DAN TEMPE,TAUHU (JENIS KERAS),1,1,1,1
BARANGAN SEGAR,TAUHU DAN TEMPE,TEMPE (BUNGKUSAN PLASTIK),1,1,1,1
BARANGAN SEGAR,TELUR,TELUR AYAM GRED A,1,1,1,1
BARANGAN SEGAR,TELUR,TELUR AYAM GRED A (BERAT 65.0 GM HINGGA 69.9 GM SEBIJI),1,1,1,1
BARANGAN SEGAR,TELUR,TELUR AYAM GRED B,1,1,1,1
BARANGAN SEGAR,TELUR,TELUR AYAM GRED B (BERAT 60.0 GM HINGGA 64.9 GM),1,1,1,1
BARANGAN SEGAR,TELUR,TELUR AYAM GRED C,1,1,1,1
BARANGAN SEGAR,TELUR,TELUR AYAM GRED C (BERAT 55.0 GM HINGGA 59.9 GM SEBIJI),1,1,1,1
BARANGAN SEGAR,TELUR,TELUR AYAM KAMPUNG,1,1,1,1
BARANGAN SEGAR,TELUR,TELUR ITIK,1,1,1,1
BARANGAN SEGAR,TELUR,TELUR MASIN,1,1,1,2
BARANGAN SEGAR,TELUR,TELUR PUYUH,1,1,1,1
MINUMAN,BAHAN-BAHAN MINUMAN,HORLICKS (PAKET),1,1,1,1
MINUMAN,BAHAN-BAHAN MINUMAN,KORDIAL F&N (SIRAP ROS),1,1,1,1
MINUMAN,BAHAN-BAHAN MINUMAN,MILO (PAKET),1,1,1,2
MINUMAN,BAHAN-BAHAN MINUMAN,MILO 3 IN 1 (PAKET) - ORIGINAL,1,1,1,1
MINUMAN,BAHAN-BAHAN MINUMAN,NESCAFE 3 IN 1 ORIGINAL (AROMATIC & BALANCED),1,1,1,1
MINUMAN,BAHAN-BAHAN MINUMAN,NESTLE COFFEE-MATE,1,1,1,1
MINUMAN,BAHAN-BAHAN MINUMAN,NESTUM (ORIGINAL),1,1,1,1
MINUMAN,BAHAN-BAHAN MINUMAN,SERBUK KOPI CAP KAPAL API (KASAR) (BERBUNGKUS),1,1,1,1
MINUMAN,BAHAN-BAHAN MINUMAN,SERBUK KOPI HANG TUAH ROBUSTA,1,1,1,1
MINUMAN,BAHAN-BAHAN MINUMAN,TEH BOH (SERBUK),1,1,1,1
MINUMAN,BAHAN-BAHAN MINUMAN,TEH BOH (UNCANG),1,1,1,1
MINUMAN,BAHAN-BAHAN MINUMAN,TEH LIPTON (SERBUK),1,1,1,1
MINUMAN,BAHAN-BAHAN MINUMAN,TEH LIPTON (UNCANG),1,1,1,1
MINUMAN,TERSEDIA MINUM,COCA COLA (BOTOL),1,1,1,1
MINUMAN,TERSEDIA MINUM,COCA COLA (TIN),1,1,1,1
MINUMAN,TERSEDIA MINUM,F&N OREN (BOTOL),1,1,1,1
MINUMAN,TERSEDIA MINUM,F&N OREN (TIN),1,1,1,1
MINUMAN,TERSEDIA MINUM,JUS OREN PEEL FRESH (MARIGOLD),1,1,1,1
MINUMAN,TERSEDIA MINUM,JUS OREN SUNKIST,1,1,1,1
MINUMAN,TERSEDIA MINUM,MIRINDA OREN (BOTOL),1,1,1,1
MINUMAN,TERSEDIA MINUM,RED BULL (BOTOL),1,1,1,1
